{
  "$schema": "./axis_spec_v2.schema.json",
  "spec_id": "sounddecisions_axis_spec_v2",
  "version": "2.0-draft",
  "status": "DRAFT_AWAITING_DUAL_PI_SIGNATURE",
  "freeze": {
    "authority": "separate_signed_envelope",
    "envelope_schema": "./axis_spec_v2.freeze.schema.json",
    "expected_envelope_path": "./axis_spec_v2.freeze.json",
    "envelope_present": false,
    "measurement_authorized": false,
    "quarantine_release_authorized": false,
    "content_hash_rule": "The freeze envelope records SHA256 for the exact bytes of each reviewed content file and a bundle SHA256 over the ordered path/hash list; the envelope is not included in its own bundle hash.",
    "rule": "Do not create the freeze envelope, record a freeze hash, authorize measurement, or release quarantine until both PIs have approved the draft and the sign-off amendment is committed."
  },
  "scope": {
    "scientific_unit": "visible event",
    "clip_is_only_a_container": true,
    "axes": [
      "presence",
      "timing",
      "class",
      "material",
      "binding"
    ],
    "causal_analysis_in_scope": false,
    "confirmatory_execution_in_scope": false
  },
  "shared_contract": {
    "anchor": {
      "representation": "closed interval [lo_s, hi_s] with source and provenance",
      "source_chain_draft": [
        "foleybench_metadata",
        "visual_onset_detector",
        "light_human_marks"
      ],
      "exact_frame_without_uncertainty_forbidden": true,
      "missing_or_unusable_anchor": "axis observation is missing for every anchor-dependent axis",
      "multiple_events": "each event receives a stable event_id and its own interval"
    },
    "missingness": {
      "missing_evidence_is_not_a_semantic_class": true,
      "undefined_values_are_never_imputed_for_primary_scoring": true,
      "coverage_and_reason_counts_are_mandatory": true,
      "allowed_reasons": [
        "missing_anchor",
        "uncertain_anchor",
        "presence_not_confidently_positive",
        "missing_onset",
        "abstain",
        "indifferent",
        "ambiguous_assignment",
        "incomplete_artifact",
        "measurement_error"
      ]
    },
    "readout_targets": {
      "primary": "fork-majority or fork-distribution value from continuations of the current state",
      "secondary": "deterministic ODE-final value",
      "separation_rule": "primary and secondary targets are stored, selected, scored, and reported separately"
    },
    "categorical_commitment": {
      "agreement": "sum_c n_c*(n_c-1)/(n*(n-1)) over distinct scorable fork pairs",
      "independent_baseline": "the same statistic across independent base-seed finals for the event",
      "gain": "(A_fork-A_ind)/(1-A_ind) only when A_ind is below the numerical video-determined boundary",
      "video_determined": "A_ind at the numerical identity boundary is a separate status and is excluded from window estimation; the scientific label video-determined additionally requires demonstrated between-video discrimination under the axis calibration gate",
      "minimum_support": "selected by a power calculation on development data and frozen before pilot outcomes"
    },
    "window_rule": {
      "commitment": "earliest sampled progress whose lower video-bootstrap confidence bound passes the development-selected commitment criterion and remains passing at all later supported points",
      "information_readout": "earliest supported progress where the readout lower confidence bound exceeds the correct null and conditioning-only baseline by the frozen development margin",
      "action_readout": "earliest supported progress additionally meeting the axis-specific accuracy and calibration criterion selected on development data",
      "unsupported_grid_points": "reported as unsupported, never interpolated into a claim"
    },
    "threshold_and_model_selection": {
      "historical_numeric_thresholds_carried_forward": false,
      "development_only": true,
      "confirmatory_labels_visible_during_selection": false,
      "procedure": "predeclare each axis candidate grid and its single preference direction; use video-disjoint nested development folds; retain candidates within one standard error of the best primary metric; apply the axis-declared preference; break remaining ties by calibration and then stable lexical order",
      "freeze_objects": [
        "metric",
        "null",
        "candidate grid",
        "selection rule",
        "support rule",
        "threshold selected on development data"
      ]
    },
    "semantic_calibration": {
      "human_claim_requires_completed_blinded_ratings": true,
      "unrated_package_is_not_validation": true,
      "existing_aggregate_sidecars_are_diagnostic_until_per_example_joins_are_available": true
    },
    "allowed_workstream_statuses": [
      "PASS",
      "UNRESOLVED",
      "INVALID_MEASUREMENT",
      "INCOMPLETE_ARTIFACTS",
      "ENGINEERING_FAILURE"
    ]
  },
  "axes": {
    "presence": {
      "scientific_meaning": "Whether the specified visible event has a corresponding audio event near its anchor; unrelated background audio does not count.",
      "unit_of_analysis": "event",
      "anchor_required": true,
      "prerequisites": [
        "usable event anchor interval",
        "event identity or description",
        "event-centered audio crop policy selected on development data"
      ],
      "target_type": {
        "hard_state": [
          "present",
          "absent",
          "uncertain"
        ],
        "continuous": "target-event presence score with component scores and confidence",
        "scorable_states": [
          "present",
          "absent"
        ]
      },
      "selection_procedure": "Predeclare target-semantic, anchor-local temporal, and acoustic-salience component families; fit candidate fusion rules and the present/absent/uncertain decision rule only in video-disjoint development folds; among candidates within one standard error of best balanced accuracy, choose the fewest-component fusion, then highest coverage, then lowest calibration error, then stable lexical ID; freeze before pilot or confirmatory outcomes.",
      "missingness": "uncertain is missing evidence and excluded from correctness/agreement denominators; its rate and reason remain mandatory",
      "reference_and_negative": {
        "positive": "audio with a semantically matched event overlapping the anchor interval",
        "negative": "event-absent or silent control for the target event",
        "hard_negative": "unrelated background audio, including salient off-target events, without the target event"
      },
      "null_and_baseline": [
        "development-cohort target-event prevalence/majority",
        "event-absent and silent controls",
        "visual-conditioning-only predictor"
      ],
      "commitment_statistic": "shared categorical commitment on present/absent with uncertain forks excluded and support reported",
      "external_readout": {
        "target": "primary and secondary readout targets kept separate",
        "metrics": [
          "balanced_accuracy",
          "per_state_recall",
          "Brier_score",
          "expected_calibration_error",
          "coverage",
          "margin_over_majority"
        ]
      },
      "internal_readout": {
        "target": "fork distribution over present/absent (primary); ODE-final state (secondary)",
        "metrics": [
          "balanced_accuracy",
          "per_state_recall",
          "Brier_score",
          "expected_calibration_error",
          "coverage",
          "margin_over_majority"
        ]
      },
      "robustness_tests": [
        "gain and loudness perturbations that preserve target-event semantics",
        "codec/resampling perturbation",
        "off-anchor unrelated-background injection must not become target presence",
        "target-event removal is a positive control and must change the state"
      ],
      "semantic_calibration": "blinded event-level present/absent/uncertain ratings; reuse existing human/MLLM evidence only as diagnostic context unless exact v2 event joins are materialized",
      "minimum_persisted_fields": [
        "measurement_id",
        "audio_id",
        "audio_sha256",
        "video_id",
        "event_id",
        "anchor_interval_s",
        "anchor_source",
        "anchor_provenance",
        "event_description",
        "component_scores",
        "fusion_rule_id",
        "continuous_score",
        "hard_state",
        "confidence",
        "abstain",
        "missing_reason",
        "measurer_version",
        "model_revisions"
      ],
      "disposition_rules": {
        "PASS": "all calibration gates pass against target-event controls with adequate support",
        "UNRESOLVED": "insufficient support, calibration, or event-level labels",
        "INVALID_MEASUREMENT": "off-target background systematically counts as presence or the detector fails the correct null",
        "INCOMPLETE_ARTIFACTS": "required anchors, component scores, controls, or provenance fields are missing",
        "ENGINEERING_FAILURE": "deterministic execution, joins, schemas, or artifact validation fail",
        "redesign_or_demotion": "redesign components/fusion on development data; exclude the axis if failure persists"
      }
    },
    "timing": {
      "scientific_meaning": "Continuous onset offset of the target audio event relative to the specified visual-event anchor.",
      "unit_of_analysis": "event with confidently positive presence",
      "anchor_required": true,
      "prerequisites": [
        "presence hard_state is present",
        "usable visual anchor interval",
        "target-event audio onset interval"
      ],
      "target_type": {
        "continuous": "delta_t_s = center(audio_onset_interval)-center(anchor_interval)",
        "uncertainty": "[audio_lo-anchor_hi, audio_hi-anchor_lo]",
        "categorical_bins": null
      },